{
  "$schema": "https://json-schema.org/draft/2020-12/schema",
  "$id": "https://citizenchris100.github.io/songwriter_notebook/feels/feel.schema.json",
  "title": "Songwriter Notebook progression feel",
  "description": "A chord-progression template. Exactly one of: DIATONIC `degrees` (scale-degree indices voiced in the app's major/minor mode); CHROMATIC `progression` (Roman-numeral tokens, absolute relative to the tonic, non-diatonic allowed); or SECTIONED `sections` (labeled chromatic blocks such as Main and Bridge).",
  "type": "object",
  "required": ["id", "name"],
  "oneOf": [
    { "required": ["degrees"], "not": { "anyOf": [{ "required": ["progression"] }, { "required": ["sections"] }] } },
    { "required": ["progression"], "not": { "anyOf": [{ "required": ["degrees"] }, { "required": ["sections"] }] } },
    { "required": ["sections"], "not": { "anyOf": [{ "required": ["degrees"] }, { "required": ["progression"] }] } }
  ],
  "additionalProperties": false,
  "properties": {
    "$schema": {
      "type": "string",
      "description": "Optional pointer to this schema (for editor validation), e.g. \"./feel.schema.json\"."
    },
    "id": {
      "type": "string",
      "pattern": "^[a-z0-9][a-z0-9-]*$",
      "description": "Unique slug. Lowercase letters, digits and hyphens; this is also the deep-link value (?feel=<id>) and the file name feels/<id>.json."
    },
    "name": {
      "type": "string",
      "minLength": 1,
      "description": "Display name shown in the picker."
    },
    "degrees": {
      "type": "array",
      "minItems": 1,
      "items": { "type": "integer", "minimum": 0, "maximum": 6 },
      "description": "DIATONIC feel: scale-degree indices (0 = I, 1 = ii, ... 6 = vii) voiced in the app's current major/minor mode. Repeats are allowed and significant."
    },
    "progression": {
      "type": "array",
      "minItems": 1,
      "items": {
        "type": "string",
        "pattern": "^(b|#)?(VII|VI|V|IV|III|II|I|vii|vi|v|iv|iii|ii|i)(5|o|dim|\\+|aug|7|maj7|m7|sus2|sus4)?$"
      },
      "description": "CHROMATIC feel: Roman-numeral chord tokens relative to the tonic (e.g. \"I\",\"bVII\",\"bVI\",\"v\",\"II7\",\"#iv\",\"I5\"). Numeral case = base quality (UPPER major, lower minor); b/# alters the root chromatically; optional suffix sets chord type (5 power, o/dim diminished, +/aug augmented, 7, maj7, m7, sus2, sus4). Mode-independent and free to be non-diatonic. Repeats are allowed and significant."
    },
    "sections": {
      "type": "array",
      "minItems": 1,
      "items": {
        "type": "object",
        "required": ["label", "progression"],
        "additionalProperties": false,
        "properties": {
          "label": { "type": "string", "minLength": 1, "description": "Section name shown as a heading, e.g. \"Main\", \"Bridge\"." },
          "progression": {
            "type": "array",
            "minItems": 1,
            "items": { "type": "string", "pattern": "^(b|#)?(VII|VI|V|IV|III|II|I|vii|vi|v|iv|iii|ii|i)(5|o|dim|\\+|aug|7|maj7|m7|sus2|sus4)?$" }
          }
        }
      },
      "description": "SECTIONED feel: ordered labeled blocks, each its own chromatic token progression (e.g. a Main section and a Bridge). Mode-independent, like a chromatic feel."
    },
    "description": {
      "type": "string",
      "description": "Optional human note about the feel."
    },
    "tags": {
      "type": "array",
      "items": { "type": "string" },
      "description": "Optional free-form tags for grouping/search."
    },
    "source": {
      "type": "string",
      "description": "Optional attribution or origin."
    },
    "schemaVersion": {
      "type": "integer",
      "enum": [1, 2, 3],
      "description": "Schema version this file targets. 1 = diatonic (degrees); 2 = chromatic (progression tokens); 3 = sectioned (labeled chromatic blocks)."
    }
  }
}
